Date,Title,Subtitle01/02/2019 às 05h00,"Petrobras tem cenário desafiador para recuperar reservas após nova queda
",Petroleira terá de fazer esforços maiores na exploração de novas descobertas se quiser manter o equilíbrio de seus recursos
01/02/2019 às 05h00,"Dommo sofre derrota no Cade na disputa com sócias
",Ex-OGX tem 40% no consórcio que explora campo de Atlanta na Bacia de Santos em parceria com QGEP e Barra Energia
31/01/2019 às 21h51,"Vale contrata escritório Skadden para investigar causas de desastre
",Escritório prestará assessoria à Vale em várias questões legais decorrentes do rompimento da barragem
31/01/2019 às 21h03,"Consumo, energia e serviços públicos lideram na bolsa em janeiro
",
31/01/2019 às 20h54,"Brasil sob nova direção incentiva aplicação em bolsa
",Ações tiveram o melhor desempenho no mês e são a modalidade preferida de gestores
31/01/2019 às 20h51,"Contrato de seguro da Vale não incluiria barragem inativa
","Pelas regras vigentes no país, mineradoras não são obrigadas a adquirir apólice"
31/01/2019 às 20h16,"Embraer e SkyWest assinam pedido de nove jatos E175
",A encomenda tem valor de US$ 422 milhões e está incluída na carteira de pedidos firmes do quarto trimestre de 2018
31/01/2019 às 20h12,"Brasil fecha 2018 com 31 milhões de contratos de banda larga fixa
","Número representou um aumento de 7,41%, ou 2,14 milhões de assinaturas do serviço no ano, em relação a 2017"
31/01/2019 às 19h54,"Heringer demite e fecha fábricas para tentar administrar endividamento
","Decisão judicial favorável a credores congelou contas da empresa, cujos resultados recentes foram negativos"
31/01/2019 às 19h47,"Número de mortos em Brumadinho sobe a 115; 248 estão desaparecidos
","Dos 110 mortos, 71 já foram identificados"
31/01/2019 às 19h38,"Banif processa General Shopping e sobe pressão contra plano da empresa
","No fim da tarde de ontem, a Banif encaminhou à 2ª Vara Empresarial e de Conflitos de Arbitragem, em São Paulo, pedido de tutela provisória "
31/01/2019 às 19h07,"MG: ONS determina retomada da operação da hidrelétrica de Retiro Baixo
",O motivo do acionamento da usina foi viabilizar a manutenção do nível do reservatório
31/01/2019 às 17h33,"Vale promete acelerar acordos extrajudiciais para indenizar vítimas
","O presidente da empresa, Fábio Schvartsman, assumiu o compromisso com a procuradora-geral da República, Raquel Dodge"
31/01/2019 às 16h30,"FT: Igreja anglicana e gestores querem mais segurança em barragens
",Fundos vão convocar uma reunião de especialistas internacionais e grandes investidores em Londres
31/01/2019 às 16h11,"Veja o que é #FATO ou #FAKE sobre o desastre em Brumadinho
",Mensagem sobre suposto ataque terrorista e vídeos fora de contexto têm viralizado
31/01/2019 às 15h13,"Vale diz que decisão de descomissionar barragens foi tomada em 2016
","Todas as barragens estavam estáveis e sendo descomissionadas em ritmo adequado, segundo a mineradora "
31/01/2019 às 15h08,"Lucro líquido da Royal Dutch Shell sobe 80% em 2018
","Em todo o ano, a petroleira anglo-holandesa registrou teve um lucro de US$ 23,35 bilhões"
31/01/2019 às 14h37,"Lista de desaparecidos da Vale está incompleta, diz membro de entidade
","O número de vítimas em Brumadinho pode chegar a mais de 600 pessoas, segundo um coordenador do Movimento dos Atingidos por Barragens (MAB)"
31/01/2019 às 14h20,"Soluções para caso de Brumadinho têm que ser extrajudiciais, diz Dodge
","A procuradora-geral da República se reúne na tarde desta quinta-feira com o presidente da mineradora, Fabio Schvartsman"
31/01/2019 às 12h18,"Porto Seguro aprova recompra de até 5 milhões de ações
",Prazo do programa é de um ano e as recompras serão feitas com recursos disponíveis na conta da Reserva de Lucros
31/01/2019 às 11h52,"Lucro da Mastercard avança 350% e vai a US$ 900 milhões
","Receita da companhia cresceu 15%, a US$ 3,8 bilhões, e ficou em linhas com projeções de analistas"
31/01/2019 às 11h46,"Moody’s vê riscos elevados para Vale após rompimento de barragem
","Na terça-feira, a agência colocou os ratings da companhia em revisão para possível rebaixamento"
31/01/2019 às 11h39,"Lucro da International Paper cai quase 80% no quarto trimestre
","Antes da incidência de impostos, o montante somou US$ 382 milhões, alta de 94% em relação aos US$ 197 milhões obtidos em 2017"
31/01/2019 às 11h32,"Conselho de Furnas discute demissão de assessores da presidência
","Comunicado da companhia nega ter havido bate-boca entre presidentes da Eletrobras, Ferreira Junior, e de Furnas, Medeiros, sobre o assunto"
31/01/2019 às 10h50,"Câmbio e tributos reduzem lucro da Diageo no 1º semestre fiscal
","Apesar da queda de 4%, houve crescimento na receita em todas as categorias e regiões de atuação da companhia"
31/01/2019 às 10h25,"67 vítimas da tragédia de Brumadinho já foram identificadas, diz Vale
","Segundo os dados mais recentes, 99 pessoas morreram na tragédia em Minas Gerais"
31/01/2019 às 09h39,"Petrobras aprova militar da Marinha para presidência do conselho
",Eduardo Bacellar Leal Ferreira ocupará a presidência do colegiado
31/01/2019 às 09h30,"Cosan marca para 8 de março oferta de aquisição de ações da Comgás
",A Cosan divulgou na manhã desta quinta-feira o edital da OPA e  o laudo de avaliação elaborado pelo Citigroup
30/01/2019 às 21h36,"Petrobras assina venda de Pasadena para Chevron por US$ 562 milhões
",O valor final ainda está sujeito a ajustes de capital de giro até a data de fechamento da transação
30/01/2019 às 21h29,"Lucro da Mondelez cresce 18,4% no 4º trimestre de 2018
","A fabricante de chocolates, doces e outros alimentos registrou lucro líquido de US$ 823 milhões no período"
30/01/2019 às 21h24,"Gol planeja ampliar transporte de cargas em 2019
","Para 2019, a projeção da companhia é que a receita com transporte de cargas e outros atinja R$ 1 bilhão, com crescimento aproximado de 25%"
30/01/2019 às 21h17,"Após recente perda recorde, investidor volta e Vale sobe 9%
",Futuro da mineradora é incerto e a governança ainda está em xeque depois da catástrofe em Minas Gerais
30/01/2019 às 21h10,"Análise: Ciclo de ata de juros pelo Fed pode ter chegado ao fim
",Quadro montado pelo BC americano para pontuar uma mudança neste ciclo foi detalhadamente construído
30/01/2019 às 21h06,"MG determina esvaziamento das barragens inativas, como a de Brumadinho
",A determinação vale para as barragens construídas com o método de alteamento a montante — o mesmo usado na barragem da Vale que rompeu
30/01/2019 às 20h37,"Justiça inclui Caixa Econômica Federal em processo de aposentados
",Juiz da 2ª Vara Federal Cível e Criminal de Governador Valadares (MG) entendeu que discussão não estava contemplada pelo repetitivo do STJ
30/01/2019 às 19h05,"Petrobras eleva diesel em 1% nas refinarias
","Com ajuste, o litro do combustível passará de R$ 1,9998 para R$ 2,0198; o preço da gasolina foi mantido em R$ 1,4907 o litro"
30/01/2019 às 18h40,"Governo direciona R$ 801 milhões para atender famílias de Brumadinho
","O valor pode ser direcionado para kits de emergência contendo água potável, colchões, barracas e outros insumos para os desabrigados"
30/01/2019 às 18h07,"Escritório americano The Schall Law entra com ação contra a Vale
","Ação busca ressarcimento de prejuízos causados a investidores, após o rompimento da barragem em Brumadinho (MG)"
30/01/2019 às 17h24,"TCU vai auditar Agência Nacional de Mineração após desastre em MG
","A relatoria será da ministra Ana Arraes, que já é a responsável por ações envolvendo o Ministério de Minas e Energia"
30/01/2019 às 17h10,"Concorrente da Vale sobe mais de 17% em NY após corte de produção
",Vale anunciou corte de produção na esteira do desastre de Brumadinho
30/01/2019 às 17h02,"Guerra comercial é 'muito negativa' para BRF, diz Parente
","Em debate em São Paulo, o CEO da companhia disse que a disputa entre EUA e China pressiona os custos e favorece os competidores americanos"
30/01/2019 às 15h09,"""Dedo gordo"" leva ação da CSN a disparar mais de 10% na bolsa
",Um erro operacional causou a disparada das ações da empresa nesta tarde
30/01/2019 às 14h59,"Acionistas querem que CVM investigue Vale por omitir informações
",
30/01/2019 às 14h49,"Número de vítimas identificadas na tragédia de Brumadinho sobe para 51
","O número de mortos confirmados permanece em 84, enquanto o total de desaparecidos continua em 276"
30/01/2019 às 13h18,"Aneel pretende fiscalizar 130 barragens de hidrelétricas até maio
","Estão enquadradas como as de maior risco as de Americana e Pirapora, ambas em São Paulo"
30/01/2019 às 12h24,"Tupperware reverte prejuízo em lucro,  mas vendas no Brasil caem
","Empresa registrou lucro líquido de US$ 17,3 milhões no quarto trimestre de 2018"
30/01/2019 às 11h46,"Caixa vai abrir capital de seguros, cartões, loterias e gestora
",O presidente do banco pretende fazer a abertura de capital de quatro subsidiárias até junho do próximo ano
30/01/2019 às 11h29,"Temos ainda um longo caminho a percorrer, diz presidente do Santander
",Sergio Rial afirmou que vê espaço para o banco continuar crescendo com alta rentabilidade neste ano
30/01/2019 às 11h20,"TIM é multada em R$ 9,7 milhões por Secretaria Nacional do Consumidor
","A empresa de telefonia cobrou por serviços nunca solicitados, segundo o Ministério da Justiça e Segurança Pública"
30/01/2019 às 11h00,"País está ‘enterrando rios e pessoas’ em Brumadinho, diz comitê 
",O Fórum Mineiro de Comitê das Bacias Hidrográficas está criando um gabinete de crise para averiguar o desastre ambiental e humano
30/01/2019 às 10h36,"Santander eleva rentabilidade e se aproxima do líder Itaú
",O banco espanhol utilizou uma estratégia baseada no aumento da receita por clientes e um empurrão grande da Getnet
30/01/2019 às 10h22,"Carrefour e Pão de Açúcar negam negociação de fusão
","Site da revista ""Época"" cogitou negociação"
30/01/2019 às 09h20,"Petrobras avalia hoje venda de Pasadena para Chevron
",As negociações estão em estágio de conclusão
30/01/2019 às 08h06,"ADRs da Vale operam em alta no pré-mercado de Nova York
",Investidores avaliam iniciativa da mineradora após tragédia de Brumadinho
30/01/2019 às 07h28,"Santander Brasil fecha 2018 com mais de R$ 12 bilhões de lucro
","O Santander Brasil obteve lucro líquido gerencial de R$ 3,405 bilhões no quarto trimestre"
29/01/2019 às 23h15,"MG suspende análise de licenciamento de barragens de rejeitos
","A medida alcança todos os pedidos de licenciamento de barragens de rejeito, independentemente do método construtivo"
29/01/2019 às 23h02,"Vale afirma que vai ‘se defender vigorosamente’ de ação coletiva em NY
","A reclamação alega, entre outros pontos, que a companhia teria feito declarações falsas e enganosas e se omitido sobre riscos em Brumadinho"
29/01/2019 às 21h58,"Em 2018, operadoras perdem  2 milhões de clientes de linhas fixas
","Segundo dados da Anatel, o ano passado encerrou com 38,3 milhões de linhas, encolhendo 5,13% na comparação com 2017"
29/01/2019 às 21h51,"Vale diz que reintegrará 5 mil funcionários de barragens desativadas
",Conselho de administração da empresa decidiu fechar todas as barragens de rejeito do tipo a montante
29/01/2019 às 21h38,"Cena externa inquieta gestores da Verde e da SPX
",Perspectivas para economia brasileira são mais animadoras
29/01/2019 às 21h22,"eBay reverte prejuízo e tem lucro de US$ 760 milhões no 4º trimestre
","Também na comparação anual, a receita líquida subiu 6,3%, para US$ 2,88 bilhões"
29/01/2019 às 20h48,"Petrobras consegue no Carf cancelar autuações de R$ 11,9 bilhões
",Decisão sobre aluguel de plataformas petrolíferas é da  1ª Turma da 4ª Câmara da 3ª Seção 
29/01/2019 às 20h16,"Mourão critica prisão de engenheiros no caso Brumadinho
","Ele também voltou a afirmar que o governo não vai intervir na Vale, ressaltando que isso não seria possível"
29/01/2019 às 18h57,"Expectativa para alta do crédito e privatizações impulsionam Ibovespa
",As ações de varejo e de companhias que podem se beneficiar da agenda de privatizações do governo voltaram a se destacar
29/01/2019 às 18h01,"Lucro da LVMH cresce 18% em 2018, com demanda aquecida na China
","A receita líquida cresceu 9,8%, para 46,83 bilhões de euros, um número recorde"
29/01/2019 às 17h50,"Bancos e gestoras cortam recomendação para ação da Vale
","De doze corretoras e bancos que divulgaram relatórios sobre o desastre de Brumadinho até agora, seis mudaram a recomendação para os papéis"
29/01/2019 às 16h26,"Dois escritórios dos EUA entram com ação coletiva contra Vale
",Outras três firmas abriram investigações a respeito de danos causados a investidores relacionados ao rompimento da barragem da mineradora
29/01/2019 às 16h24,"Presidente da Vale apresenta ao governo plano de segurança de barragem
",A Vale tem no total 133 barragens com diferentes características
29/01/2019 às 16h19,"Agência de risco ambiental rebaixa Vale após Brumadinho
","A Sustainalytics é usada por gestores de recursos para ranquear empresas segundo os critérios EFG (Environmental, Social and Governance)"
29/01/2019 às 15h09,"Moody’s coloca ratings da Vale em revisão para possível rebaixamento
","Agência informou que a análise vai considerar, por exemplo, potenciais passivos e sanções sobre a empresa e seus executivos"
29/01/2019 às 13h52,"Ministro diz que Vale vai desativar barragens ou fazer contenção
",Bento Albuquerque afirmou que o governo está em contato frequente com a Vale
29/01/2019 às 13h03,"Carteira diversificada absorverá efeitos de ações da Vale, diz Previ
","Fundação detém participação na mineradora por meio da Lite, que, por sua vez, é dona de cerca de 22% da empresa"
29/01/2019 às 13h00,"Onyx diz que golden share não autoriza governo a intervir na Vale
",Ministro declarou que os acionistas têm que confiar na gestão da diretoria e que o governo precisa saber que tem limitações
29/01/2019 às 12h52,"Vale nomeia executivo para comitê de ações emergenciais em Brumadinho
",Cláudio Alves está na companhia desde 1992 e ocupava há dois anos a diretoria de pelotização e manganês
29/01/2019 às 11h43,"Após privatização, Cesp diz que não fará novos investimentos
",O foco da nova administração da companhia é melhorar a gestão da e sanear problemas judiciais
29/01/2019 às 09h54,"Vamos manter apenas Petrobras, BB e Caixa, diz secretário
","O secretário especial de desestatização e desinvestimento, Salim Mattar, afirmou que a ideia de Bolsonaro é manter só essas três estatais"
29/01/2019 às 09h36,"Copel anuncia novos diretores-presidentes de subsidiárias
","A empresa também anunciou medidas de melhoria de eficiência e redução de custos, que possibilitarão uma economia anual de R$ 10 milhões"
29/01/2019 às 09h15,"Petrobras reduz preço da gasolina e mantém inalterado preço do diesel
","Com isso, o preço médio do litro da gasolina se passará de R$ 1,5104 para R$ 1,4907 entre hoje e amanhã"
29/01/2019 às 07h55,"Leia as manchetes desta terça-feira dos principais jornais brasileiros
",Veja os destaques da imprensa nacional
29/01/2019 às 07h45,"ADR da Vale retoma alta no pré-mercado de Nova York
",Movimento dos papéis ocorre depois de queda de 18% na segunda-feira
29/01/2019 às 07h37,"Atividades da Samarco não serão retomadas neste momento, diz BHP
",A mineradora australiana declarou que as operações da empresa serão retomada apenas quando for seguro e economicamente viável
28/01/2019 às 21h46,"Fundos de pensão perdem R$ 16 bi em um dia com queda de ações da Vale
","Prejuízo levantou dúvidas sobre a viabilidade de venda da participação das fundações na mineradora, em 2019"
28/01/2019 às 21h17,"BB estuda parceria ou IPO de gestora de recursos
",ideia de fechar uma parceria começou a ganhar relevância para novo comando do banco
28/01/2019 às 21h16,"Portabilidade de salário avança e incomoda instituições
","Operação começou a ganhar força a partir de julho, com a autorização para pedido feito diretamente no banco a ser migrado"
28/01/2019 às 21h13,"Reação de fundos com viés ambiental são risco para ações da Vale
",Tem avançado principalmente na Europa a adoção de critérios chamados de ESG na decisão de investimentos financeiros
28/01/2019 às 20h57,"Empresa de cartões Cielo vê lucro cair em 2018
","Credenciadora ganhou R$ 3,3 bilhões em todo o ano passado"
28/01/2019 às 20h52,"Whirlpool reverte prejuízo em lucro de US$ 170 milhões no 4º trimestre
","De outubro a dezembro de 2018, a receita caiu 0,7%, em base anual, para US$ 5,66 bilhões"
28/01/2019 às 20h26,"Tribunais federais livram empresas do adicional de 10% do FGTS
","Desembargadores aceitaram nova tese contra a cobrança, instituída em 2001 por meio de lei complementar "
28/01/2019 às 19h55,"Vale deposita R$ 1 bilhão ordenado pela Justiça, diz MG
",Os demais pedidos veiculados na ação movida pelo Estado de Minas Gerais - como o bloqueio de ações da Vale - ainda aguardam apreciação
28/01/2019 às 19h26,"Fitch rebaixa rating global da Vale de ‘BBB+’ para ‘BBB-’
","Em escala nacional, o rating permaneceu em ‘AAA (bra)’, mas com perspectiva negativa"
28/01/2019 às 19h24,"Porta-voz confirma que governo estuda como trocar chefia da Vale 
","""Estudos estão sendo aprofundados para que a decisão seja tomada adequadamente e naturalmente dentro dos ditames legais"", afirmou"
28/01/2019 às 19h19,"Vale vai doar R$ 100 mil para cada família de vítimas em Brumadinho
","Executivo destacou que se trata de uma doação, sem vínculo com futuras indenizações"
28/01/2019 às 18h53,"Ibovespa fecha queda após perda recorde da Vale
","Vale perder R$ 72,8 bilhões e o posto de terceira companhia mais valiosa da bolsa"
28/01/2019 às 17h43,"JP Morgan: Custo de Brumadinho para Vale pode ser menor que de Mariana
","No caso da Samarco, analistas do J.P. Morgan estimam que o valor chegou a R$ 20 bilhões"
28/01/2019 às 17h18,"Renner investirá até R$ 37 milhões em operação na Argentina
","Varejista abrirá duas unidades em Buenos Aires e uma em Córdoba; segundo presidente, decisão deveu-se ao bom desempenho no Uruguai"
28/01/2019 às 17h11,"Seguradoras estimam perdas de US$ 4,5 bilhões da Vale com Brumadinho
","Do total de perdas identificadas pelo setor, US$ 4 bilhões dizem respeito a danos a terceiros, inclusive ao meio ambiente"
28/01/2019 às 16h15,"Responsável por auditar barragem da Vale diz colaborar com autoridades
","Alemã Tüv Süd informou que que realizou duas avaliações da estrutura  em 2018, uma em junho e outra em setembro"
28/01/2019 às 16h06,"Escritório de advocacia dos EUA inicia investigação contra Vale
",Dentre os objetivos está o de averiguar se a companhia brasileira e diretores violaram leis federais americanas
28/01/2019 às 15h37,"Vale perde R$ 72,8 bi em valor de mercado na maior queda da história
",A Vale ON tem participação de 11% no Ibovespa
28/01/2019 às 15h02,"Reprecificação da Vale deve se estender pelos próximos meses
","Por ser um dos papéis mais negociados na bolsa brasileira, muitos fundos de investimentos podem ter que acionar o mecanismo de “stop loss”"
28/01/2019 às 13h44,"Advogados da Vale tentam reverter bloqueio de R$ 11 bilhões 
",O mineradora contratou o mesmo escritório de advocacia que atuou no desastre de Mariana
28/01/2019 às 13h25,"Governo diz que grupo estuda eventual afastamento da diretoria da Vale
","Presidente em exercício ressaltou que a punição tem que “doer no bolso”, e lembrou as multas que já foram aplicadas à empresa"
28/01/2019 às 12h55,"Minerva receberá mais de R$ 40 milhões da Marfrig por venda de unidade
","Na semana passada, empresas anunciaram troca de frigoríficos em Mato Grosso"
28/01/2019 às 12h29,"CVM abre processo para investigar comunicação da Vale sobre Brumadinho
",A mineradora será investigada sob o ponto de vista de divulgação de informações ao mercado no caso da tragédia de Brumadinho
28/01/2019 às 12h24,"Análise: Vale, o cataclismo aconteceu
",Executivos e acionistas têm explicações a dar sobre a tragédia de Brumadinho
28/01/2019 às 12h13,"Incêndio paralisa unidade da Petrobras no Espírito Santo
","Segundo a empresa, o incêndio está controlado e não houve vítimas, nem risco para as comunidades próximas"
28/01/2019 às 12h01,"Polícia inicia investigação sobre rompimento de barragem em Brumadinho
",Os oficiais da Polícia Civil de MG afirmam que ainda não é possível apontar causas
28/01/2019 às 11h48,"FT: Festejada pelo mercado, a Vale agora está ameaçada
","Animado com seu sucesso à frente da companhia, recentemente Fabio Schvartsman estendeu seu contrato por dois anos, até 2021"
28/01/2019 às 11h29,"Famílias de Brumadinho reclamam de call center da Vale
",Parentes de desaparecidos na tragédia têm procurado os jornalistas para mais informações sobre nomes de vítimas
28/01/2019 às 11h27,"Ação que pedia bloqueio de R$ 1,6 bi da Vale foi parcialmente deferida
","Segundo o procurador-geral do Trabalho, a liminar foi deferida parcialmente nesta segunda (28) com o bloqueio de R$ 800 milhões"
28/01/2019 às 10h48,"Número de mortos em Brumadinho sobe para 65
","Dois corpos foram encontrados na manhã desta segunda-feira, segundo os Bombeiros"
28/01/2019 às 10h41,"Ibovespa tem queda forte, puxado pelo recuo da Vale
","As ações ordinárias da companhia despencam nesta segunda-feira - o papel tem 10,9% de peso na carteira do Ibovespa"
28/01/2019 às 10h39,"XP alerta para licenciamentos mais duros e efeito na produção da Vale
","Desastre em Brumadinho (MG) pode levar a revogação de licenças operacionais e processos no Brasil e nos Estados Unidos, vê HSBC"
28/01/2019 às 10h04,"Executivos da Vale podem ter responsabilidade penal, diz Raquel Dodge 
",A procuradora-geral da República afirmou ainda que a empresa deve ser severamente responsabilizada do ponto de vista indenizatório
28/01/2019 às 09h58,"Israel tentará achar sinais de celulares debaixo da lama em Brumadinho
",A tecnologia para identificar corpos soterrados em cerca de cinco metros começará a ser aplicada hoje
28/01/2019 às 09h12,"Banco Inter analisará possibilidade de distribuir ações ordinárias
",O banco não respondeu como seria feita essa eventual distribuição de ações 
28/01/2019 às 08h43,"Bolsas da Europa abrem em leve baixa; mineradoras sobem em Londres
",Os mercados globais de ações iniciaram a semana em baixa
28/01/2019 às 00h23,"Conselho da Vale suspende pagamento de dividendos e JSCP
",Também foram constituídos dois Comitês Independentes de Assessoramento Extraordinário (Ciae) ao Conselho de Administração
27/01/2019 às 20h22,"Minério de ferro pode subir acima de US$ 80/t, avalia BTG Pactual
","Para o banco, potenciais procedimentos de segurança que afetam outras minas na região podem estreitar relação entre oferta e demanda"
27/01/2019 às 19h40,"Renan defende o afastamento de diretores da Vale após desastre
","Senador quer nomeação de diretoria interventora, para impedir destruição de provas e isenção na apuração de causas de acidente em Brumadinho"
27/01/2019 às 18h42,"Ruído dos helicópteros acalma Brumadinho
",Buscas por vítimas foram retomadas depois de 19 horas suspensas
27/01/2019 às 18h40,"Presidência mantém gabinete de crise para atualizações de Brumadinho
","Mesmo internado, o presidente Jair Bolsonaro será abastecido diariamente com informações sobre o desastre"
27/01/2019 às 18h38,"Vale vai criar colchão de segurança, diz presidente
","Companhia irá ""além de toda e qualquer norma nacional e internacional"", diz Fabio Schvartsman"
27/01/2019 às 16h56,"CVM edita norma sobre  CRI e CRA e infração em fundos
",Nova instrução limita as distribuições com esforços restritos àqueles emitidos por companhias securitizadoras registradas
27/01/2019 às 16h53,"Varejo aquecido estimula parcerias com seguradoras
","Após anos estagnado no patamar de R$ 15 bilhões em prêmios, mercado espera avanço em 2019"
27/01/2019 às 16h52,"Bancos vão acelerar vendas de crédito podre
",Até R$ 40 bilhões em carteiras podem ser negociadas em 2019
27/01/2019 às 15h58,"Vale foi incompetente e irresponsável, diz prefeito de Brumadinho
","Ele ressaltou que todas as licenças são do Estado, e não do município"
27/01/2019 às 15h31,"Sobe para 58 número de mortos em Brumadinho, diz Corpo de Bombeiros
","Já foram resgatadas 192 pessoas; trabalhos continuam durante a noite, pois foi encontrado um ônibus, com possíveis vitimas"
27/01/2019 às 13h48,"Justiça de MG bloqueia mais R$ 5 bilhões da Vale
","Já são R$ 11 bilhões em recursos bloqueados da mineradora desde o rompimento de uma barragem em Brumadinho, na sexta-feira (25)"
27/01/2019 às 13h19,"S&P coloca nota da Vale em observação para rebaixamento
",A medida reflete os riscos de contingência que a mineradora enfrentará depois do rompimento da barragem em Brumadinho (MG)
27/01/2019 às 12h29,"Após tragédia, mineração vai precisar se reinventar no Brasil
","Ampla revisão do setor terá que passar, em primeiro lugar, pelas próprias mineradoras e exigirá fazer um “recall” das barragens"
