Date,Title,Subtitle
13/03/2019 às 21h09,"Lucro da Braskem recua 30% em 2018
","A maior fabricante de resinas termoplásticas das Américas registrou lucro líquido de R$ 2,87 bilhões no ano passado; receita avançou 18%"
13/03/2019 às 21h09,"Ativo real compõe carteira de investidor
", Opções incluem de private equity e crédito ‘podre’ a financiamento de turbinas e royalties musicais
13/03/2019 às 21h05,"Economia fraca coloca juro neutro em debate
"," Para analistas, atividade pode precisar de mais estímulo para firmar recuperação"
13/03/2019 às 21h04,"Morgan Stanley compra 14,5% da Somos Educação
","Nesta quarta (13), o fundo Farallon Capital comunicou ao mercado que também comprou 10% da companhia de educação básica"
13/03/2019 às 20h05,"Vale anuncia mudança em comitê sobre segurança de barragens
","A decisão, segundo a companhia, visa dar ao grupo “ainda maior expertise técnica internacional em barragens”"
13/03/2019 às 19h59,"BRF reestrutura food service e prevê crescer ‘dois dígitos’
","No ano passado, empresa faturou R$ 2,3 bilhões no segmento "
13/03/2019 às 18h53,"STJ volta a julgar se União deve arcar com empréstimo compulsório
",Três dos dez ministros votaram até agora; dois se manifestaram contra o pedido da empresa e um a favor
13/03/2019 às 17h45,"Petrobras aumenta em 6% os preços do GLP empresarial
","O Sindigás estima que, com o reajuste, o GLP empresarial continua 16,6% mais caro do que o gás comercializado em embalagens de até 13 quilos"
13/03/2019 às 13h45,"Redução de subsídios ao açúcar na Índia ainda pode evitar briga na OMC
","É o que disse Pedro Mizutani, presidente do conselho de administração da Unica"
13/03/2019 às 13h38,"Volkswagen suspende abertura de capital de unidade de caminhões
",Montadora informou que mantém a intenção de listar as ações em bolsa quando as condições de mercado melhorarem
13/03/2019 às 13h31,"Marfrig quer ampliar abate de bovinos da raça angus
","Crescimento previsto chega a 40%; em 2018, foram cerca de 130 mil animais"
13/03/2019 às 13h28,"Presidente do conselho da São Martinho ocupará o mesmo cargo na Unica
","Marcelo Ometto vai substituir Pedro Mizutani, da Raízen"
13/03/2019 às 13h21,"Demanda aquecida reduz estoques de etanol no Centro-Sul na entressafra
","Nos cálculos da Datagro, volume é suficiente para duas ou três semanas de consumom quando a oferta da nova safra deverá entrar no mercado"
13/03/2019 às 12h49,"Tenda prevê que até 30% das vendas do ano venham do Minha Casa 1,5
","Em 2018, o segmento respondeu por 55% das vendas, e a faixa 2 do programa ficou com a fatia de 45%"
13/03/2019 às 12h22,"BB planeja captar até US$ 750 milhões em emissão de bônus no exterior
","Os papéis terão prazo de cinco anos e a indicação inicial de taxa é em torno de 5% ao ano, segundo fonte"
13/03/2019 às 11h46,"Latam: É difícil dizer se vamos ou não fazer uma oferta pela Avianca
","""Estamos monitorando dia a dia para ver a evolução desse assunto”, afirmou Jerome Cadier, presidente da companhia no Brasil"
12/03/2019 às 23h15,"Veto a avião da Boeing se espalha pelo mundo
",
12/03/2019 às 21h55,"Minerva reduz alavancagem, mas tem prejuízo
",
12/03/2019 às 20h57,"Mercado Livre quer captar US$ 2 bi para ampliar caixa
",
12/03/2019 às 20h54,"PetroRio prepara captação de US$ 400 milhões na Noruega
",
12/03/2019 às 17h43,"Cosan lança campanha publicitária e vai patrocinar  corridas de rua 
",Objetivo  é dar mais visibilidade à marca Cosan e vincular nome do grupo aos negócios de varejo de combustível e de gás natural e logística
12/03/2019 às 17h08,"STJ começa a julgar condenação bilionária da Bradesco Seguros
",Seguradora recorre de decisão da segunda instância da Justiça que a obriga a pagar indenização por distribuir software de terceiros
12/03/2019 às 15h46,"Castello Branco quer transformar Petrobras em produtor de baixo custo
","Presidente da estatal participa da CeraWeek, na cidade americana de Houston"
12/03/2019 às 11h54,"Agibank lucra R$ 153 milhões em 2018 e supera 1 milhão de clientes
","A carteira de crédito bruta teve crescimento de 52,7%, a R$ 1,552 bilhão. A maior parte está em crédito pessoal"
12/03/2019 às 11h21,"Vulcabras Azaleia prevê mais de R$ 100 milhões em crédito de ICMS
",Companhia espera contabilizar parte dos ganhos ainda no primeiro semestre de 2019
12/03/2019 às 11h16,"M. Dias Branco espera melhora do desempenho na categoria de biscoitos 
",A fabricante de alimentos um resultado melhor na venda neste ano
12/03/2019 às 11h02,"Petrobras capta US$ 3 bi com bônus de 10 e 30 anos
",O dinheiro vai financiar uma recompra de papéis mais antigos e mais caros 
12/03/2019 às 10h44,"Justiça revoga liminar e libera emissão de bônus da Eldorado Brasil
","Companhia vai solicitar formalmente a documentação necessária da Paper Excellence para constituição do trustee, apurou o Valor"
12/03/2019 às 09h52,"Mercado Livre anuncia oferta de ações de US$ 1,85 bilhão
",A empresa anunciou um investimento de US$ 750 milhões do PayPal e de US$ 100 milhões da Dragoneer
12/03/2019 às 09h46,"Petrobras aumenta pelo 2° dia seguido o preço da gasolina
","O preço médio do litro da gasolina passará de R$ 1,7542 para R$ R$ 1,7700"
12/03/2019 às 09h36,"Burger King Brasil fará oferta subsequente de ações
","A operação para dar saída aos investidores Vinci Partners, Sommerville Investments e Montjuic poderá movimentar R$ 765 milhões "
12/03/2019 às 08h57,"Agência europeia veta todas as operações com Boeing 737 Max
",Lista de países que suspenderam temporariamente o uso da aeronave aumentou
12/03/2019 às 05h00,"Petrobras espera avançar na venda da TAG, Braskem e BR
",A negociação da Transportadora Associada de Gás pode ser fechada ainda neste mês
12/03/2019 às 05h00,"JSL divulga lucro e receita recordes em 2018
","O faturamento do grupo somou R$ 8,1 bilhões, alta de 11,3% sobre 2017"
12/03/2019 às 05h00,"Bradespar 'contra-ataca' a Litel em caso Daniel Dantas
",A empresa de participações acionárias do Bradesco pede indenização de R$ 900 milhões
11/03/2019 às 21h21,"Lucro da Multiplus em 2018 cai 31,1%
","A empresa de programas de fidelidade anotou lucro de R$ 356,4 milhões no acumulado do ano passado; no 4º trimestre o lucro cresceu 26,5% "
11/03/2019 às 21h13,"Aplicação fora do sistema dá margem a fraude
","Excesso de confiança, promessa de ganhos expressivos e ideia de escassez alimentam esquemas"
11/03/2019 às 21h12,"Investidor estrangeiro eleva  aposta no fortalecimento do dólar
","Nas quatro sessões iniciais do mês, compras da moeda americana somaram US$ 2 bi"
11/03/2019 às 20h28,"Gol decide suspender voos com aviões Boeing 737 Max 8
","Modelo é o mesmo da Ethiopian Airlines que caiu domingo, matando 157 pessoas; a Gol opera voos internacionais com 7 aeronaves desse modelo"
11/03/2019 às 20h15,"Bradesco Seguros contesta no STJ condenação por distribuir software
","Segundo a empresa que desenvolveu o programa, seu uso por corretores da seguradora estava condicionada à prévia indicação de usuários"
11/03/2019 às 19h59,"Vulcabras Azaleia registra lucro de R$ 46,2 milhões no 4º trimestre
","Também na comparação anual, a receita líquida subiu 12,5%, para R$ 354 milhões"
11/03/2019 às 19h27,"Marfrig assume controle indireto de outro frigorífico nos EUA
","National Beef adquire o Iowa Premium, que fatura US$ 700 milhões"
11/03/2019 às 18h58,"Dólar cai com trégua externa e sinais de articulação pró-reforma
",O mercado de câmbio encontrou motivos para devolver parte do prêmio de risco acumulado nos últimos dias
11/03/2019 às 18h41,"Petrobras eleva gasolina em 1,47% nas refinarias
","Com o ajuste, o litro da gasolina passará de R$ 1,7287 para R$ 1,7542; já o litro médio do diesel permanecerá R$ 2,1871"
11/03/2019 às 17h56,"Produtores de tabaco acertam novos preços com Souza Cruz e JTI
","Os preços do tabaco foram reajustados em 4,5% com a JTI e em 3,5% com a Souza Cruz; não houve acordo com a Philip Morris"
11/03/2019 às 17h53,"Usina Batatais estima aumento de 8% na moagem de cana de 2019/20
","A companhia deve manter o ""mix"" produtivo voltado ao etanol em 58% da cana"
11/03/2019 às 17h40,"EDP Portugal sai de perda e lucra 222 milhões de euros no 4°trimestre
","Custos com vendas de energia recuaram de 2,82 bilhões de euros, no mesmo período de 2017, para 2,73 bilhões de euros"
11/03/2019 às 16h42,"Tesla volta atrás, mantém lojas abertas e eleva preços de carros
","Após fechar 10% de suas lojas, a empresa disse que vai reabrir algumas unidades que possui alta visibilidade, mas com menos funcionários"
11/03/2019 às 16h41,"Dona da Levi’s pretende levantar até US$ 587 milhões em IPO
",Os papéis serão listados na Bolsa de Nova York (Nyse) com o código LEVI
11/03/2019 às 14h45,"Procon-SP pede a Gol para suspender voos com Boeing 737 MAX 8
","No Brasil, apenas a Gol possui aviões deste modelo e opera com sete deles em rotas para os Estados Unidos, América do Sul e Caribe"
11/03/2019 às 14h26,"CCR oferece R$ 160 milhões e vai operar linha Prata do metrô de SP
","Ágio foi de 0,59% em relação à outorga mínima do leilão, de cerca de R$ 159 milhões"
11/03/2019 às 14h10,"Um dos principais executivos do Carrefour Brasil deixa o cargo
",José Luis Gutierrez vai assumir uma outra função na Itália; o presidente do Carrefour Brasil vai acumular a função dele por aqui
11/03/2019 às 11h26,"Em negócio com Avianca, Azul está de olho em voos no Rio e em SP
","A aérea quer comprar todos os direitos de pousos e decolagens nos aeroportos de Congonhas, Guarulhos e metade no Santos Dummont"
11/03/2019 às 09h59,"Acionistas da Telefônica Brasil votam hoje orçamento para 2019
","A quantia é 8,54% maior em relação aos R$ 8,2 bilhões registrados no ano passado"
11/03/2019 às 09h20,"TRT cassa liminar que permitia eleito em cargo no conselho da Usiminas
","No início de fevereiro, Miranda foi eleito representante dos trabalhadores no conselho da siderúrgica, que defende o resultado"
11/03/2019 às 08h31,"Azul fecha acordo para adquirir ativos da Avianca por US$ 105 milhões
","O processo de aquisição está sujeito a uma série de condições, segundo a empresa"
11/03/2019 às 05h00,"CVM questiona atuação do BTG na Gerdau
","No papel de acionista, banco atuou alinhado aos controladores na eleição em separado para o conselho fiscal"
11/03/2019 às 05h00,"Petrobras concentra esforços no pré-sal e fica mais enxuta
","Estatal se torna menos verticalizada, num momento em que seus pares buscam novos negócios"
10/03/2019 às 17h25,"Petrobras negocia por R$ 1 bilhão venda de campos terrestres no NE
","Desde 2017, empresa colocou à venda nove polos de produção terrestre e vendeu apenas um"
09/03/2019 às 16h22,"Famílias de Brumadinho receberão cesta básica mensal da Vale por 1 ano
",A garantia da cesta básica junta-se a outros compromissos pactuados em um termo de ajuste preliminar
09/03/2019 às 13h22,"Concessão de 12 aeroportos será leiloada sexta-feira em São Paulo
",
09/03/2019 às 08h22,"InterCement faz mudanças e nomeia novo presidente
",
09/03/2019 às 00h44,"Presidente do Fed diz que não há necessidade de alterar as taxas agora
","Jerome Powell diz, em discurso a ser proferido segunda-feira em Stanford, que o cenário atual não exige uma resposta política imediata"
08/03/2019 às 21h40,"Petrobras planeja PDV e cortes em gastos operacionais e patrocínios
",
08/03/2019 às 21h24,"Vale acata decisão de afastar e realocar funcionários após Brumadinho
",
08/03/2019 às 19h17,"Ibovespa sobe com melhora do movimento do petróleo
",
08/03/2019 às 17h35,"Oferta de ações da Comgás pela Cosan movimenta R$ 1,6 bilhão
","Companhia comprou 19.496.165 papéis da distribuidora de gás natural, um pouco abaixo das 19.501.678 ações habilitadas, a R$ 82,00 a unidade"
08/03/2019 às 16h34,"'30% Club', que incentiva mulheres em conselhos, chega ao Brasil
",Presença feminina em conselhos de administração no Brasil tem patinado ao redor de menos de 8% ao longo desta década
08/03/2019 às 16h29,"Investidores pressionam por avanço feminino na liderança de empresas
","Gestoras, como a britânica Hermes, já avisaram que votarão contra chapas para conselho de administração que tenham apenas homens"
08/03/2019 às 16h00,"Odebrecht e Camargo Corrêa brigam por obra do metrô de Salvador
","Consórcio liderado pela Queiroz Galvão, que apresentou o segundo melhor preço, foi habilitado após desclassificação da Camargo"
08/03/2019 às 13h39,"TCU cria secretaria para fiscalizar bancos públicos e fundos de pensão
","Foram realizadas reuniões com as administrações das instituições para entender a agenda de prioridades, informou o tribunal"
08/03/2019 às 13h38,"Eneva prepara oferta de ações para dar saída a sócios
",
08/03/2019 às 10h31,"Lideranças não estão preparadas para século XXI, diz CEO do Santander
","O executivo ainda afirmou que a discussão da diversidade é uma agenda de negócios, já que é fundamental para a nova geração"
08/03/2019 às 09h41,"Cade aprova venda de Pasadena da Petrobras para Chevron nos EUA
","Para o Cade, a Chevron não tem atuação relevante no Brasil"
08/03/2019 às 09h12,"BB Seguridade diz que não há qualquer decisão de alienar fatia no IRB
","Não há qualquer deliberação sobre o assunto, dizem as empresas envolvidas "
08/03/2019 às 05h00,"Ale define seu primeiro plano de negócios sob comando da Glencore
","Distribuidora prevê faturamento de R$ 15 bi neste ano, alta de 20% sobre 2018"
08/03/2019 às 05h00,"ExxonMobil planeja perfurar ao menos cinco poços no país até 2020
",Petroleira foi líder em aquisições nos leilões da ANPetróleo de 2017 e 2018
07/03/2019 às 19h25,"Avianca Brasil atrasa salários de pilotos e comissários, diz sindicato
",Segundo o Sindicato Nacional dos Aeronautas (SNA) a aérea atrasa o pagamento de salários de pilotos e comissários desde janeiro
07/03/2019 às 18h28,"Petrobras eleva gasolina em 2,5% e diesel em 1,9% nas refinarias
","O preço médio do litro da gasolina passará de R$ 1,6865 para R$ 1,7287, e o do diesel subirá, na média, de R$ 2,1462 para R$ 2,1871"
07/03/2019 às 17h21,"Airbnb adquire site de reservas de quartos de hotéis Hotel Tonight
",Compra ocorre no momento em que o Airbnb busca ampliar seu portfólio de acomodações em busca de uma plataforma de viagens ponta a ponta
07/03/2019 às 16h23,"Anatel corrige para 31,1 milhões o número de assinantes de banda larga
","Em 27 de fevereiro, a agência reguladora havia informado que existiam 31,2 milhões de contratos ativos do serviço em janeiro"
07/03/2019 às 16h08,"Mais de 90% das pessoas que tentam viver de ‘day trade’ têm prejuízo
",É muito difícil ter sucesso num mercado com grandes operadores e investidores institucionais com recursos e tecnologia
07/03/2019 às 15h57,"País não pode ser refém de preconceito sobre energia nuclear, diz MME
","Ministro disse nos EUA que o governo irá tratar do tema com sociedade civil, academia, Congresso e o setor"
07/03/2019 às 13h08,"Xerox vai reorganizar estrutura e criar holding
","Empresa informou que a medida visa dar maior flexibilidade em termos estratégicos, operacionais e financeiros"
07/03/2019 às 09h59,"CCR diz que não tem conhecimento de novas investigações em SP
",A companhia informou ainda que continua contribuindo com as autoridades públicas 
07/03/2019 às 09h52,"Amazon, Berkshire e J.P Morgan lançam site de empresa de saúde 
",A joint venture na área de saúde entre as três gigantes irá se chamar Haven
07/03/2019 às 05h00,"Vale era 'interlocutor', diz delator da Lava-Jato
",Ex-presidente era admirado por ter comandado um dos maiores conglomerados de infraestrutura da América Latina
07/03/2019 às 05h00,"Acionistas reagem com defesa da gestão e reclamação no regulador
",Investidores divergem sobre modelo de governança da CCR
07/03/2019 às 05h00,"Modelo pioneiro da CCR é posto em xeque
","Primeira a aderir ao Novo Mercado, companhia envolveu-se em escândalo de pagamento de propina"
07/03/2019 às 05h00,"Klabin pode adiar expansão após revés sobre royalty
",
06/03/2019 às 20h51,"Citi tem interesse em estruturar operação de empréstimo a Estados
",
06/03/2019 às 20h50,"BB Seguros quer vender fatia no IRB em oferta pública
",Acionistas do bloco de controle da resseguradora têm preferência na operação
06/03/2019 às 19h23,"Tráfego de passageiros da Azul sobe 18,4% em fevereiro
","O total de passageiros registrados pela aérea no mês passado foi de 2,07 milhões"
06/03/2019 às 15h56,"Promessa de 'ganho fixo' deve ser evitada por analistas, diz CVM
","Autarquia publicou ofício esclarecendo pontos sobre atividade de analista de valores mobiliários, que passou a ser regida pela instrução 598"
06/03/2019 às 14h23,"FT: Por que o plano de fusão da Alitalia pode acabar em lágrimas  
",O governo italiano segue empenhado em seguir adiante com um dos planos mais estranhos de estratégia comercial da Europa
06/03/2019 às 14h00,"Dólar salta mais de 1% em dia de críticas à capacidade de comunicação
",Alta pode ser sinal de que a tolerância do mercado com ruídos de comunicação do governo está se esgotando
06/03/2019 às 12h43,"Brasil é destaque em liderança financeira feminina, aponta estudo
","Pesquisa do UBS mostra brasileiras, ao lado das mexicanas, como aquelas com maiores taxas de liderança nas decisões financeiras familiares"
06/03/2019 às 11h20,"Cade aprova venda de direitos no campo de Maromba para BW Offshore
",Companhia fechou neste ano a compra da participação de 70% da Petrobras e de 30% da Chevron na área
06/03/2019 às 11h13,"Dona do Jack Daniel’s aumenta lucro após expansão internacional
",A fabricante americana de destilados Brown-Forman teve uma alta de 11% no terceiro trimestre do ano fiscal anterior
06/03/2019 às 09h48,"Corretora de seguros Aon estuda comprar rival Willis Towers Watson
","As negociações ainda estão em estágio preliminar, mas a ideia é fechar um acordo feito inteiramente via troca de ações"
06/03/2019 às 05h00,"Com mais competição, Alelo reforça estratégia
",Mais bancos disputam o mercado de benefícios corporativos
05/03/2019 às 20h29,"Ações do Spotify sobem 4% com bom começo na Índia
","A Índia é obviamente um grande mercado, no qual o Spotify pode esperar um crescimento significativo de usuários e assinantes"
05/03/2019 às 18h54,"Mais competição não basta para reduzir spread, diz Loyola
","Para ex-presidente do BC, crédito caro reflete falta de informações e dificuldade de executar garantias"
05/03/2019 às 18h34,"BRF perde mais de R$ 200 milhões em  derivativo de ações
","Companhia apostou na alta dos próprios papéis em 2017, mas valor de mercado diminuiu 40% "
05/03/2019 às 18h14,"Ação da Vale fecha em alta de 2% em Nova York
",Os papéis abriram a sessão praticamente estáveis e logo viraram para cima
05/03/2019 às 18h12,"Acionista da Barrick Gold opõe-se à compra da Newmont Mining
","Na última semana, a Barrick fez uma oferta hostil pela Newmont, que não foi aceita"
05/03/2019 às 17h29,"FT: AB InBev vai trocar o presidente do conselho Olivier Goudet
","Aquisição, no ano passado, da fabricante de café e bebidas gaseificadas Keurig Dr Pepper pela JAB, despertou preocupações "
05/03/2019 às 15h02,"Ação da Vale no Ibovespa deve absorver efeitos da troca de comando
","Segundo analistas, a saída de Schvartsman atende a uma demanda para acalmar os ânimos da opinião pública "
05/03/2019 às 14h23,"Vale terá que arcar com consequências de Brumadinho, diz ministro
",Albuquerque afirmou ainda que não diz respeito a ele a decisão anunciada pelo conselho da Vale no sábado de afastar Fabio Schvartsman
05/03/2019 às 10h07,"Maioria dos ativos brasileiros opera em alta no mercado americano
",Os ativos brasileiros negociados em Nova York aceleraram os ganhos nesta tarde
04/03/2019 às 19h47,"Vale contratou Tüv Süd após auditor se recusar a certificar barragem
",Especialistas da Tractebel teriam descoberto que os critérios de medição da estabilidade estavam muito abaixo dos níveis recomendados
04/03/2019 às 19h28,"Hering terá de explicar uso de reconhecimento facial ao Idec
",O instituto suspeita que a iniciativa possa incorrer em uma série de violações dos direitos de quem frequenta a loja
04/03/2019 às 16h47,"Crise da Vale pode beneficiar ações atreladas ao aço nos EUA
",Produtores globais lutam para preencher uma lacuna de 70 milhões de toneladas de minério de ferro que estão fora do mercado
04/03/2019 às 15h17,"Bolsas da Europa fecham em alta com otimismo sobre acordo ""EUA-China""
","O setor automobilístico europeu, mais afetado pela disputa comercial, conseguiu com a notícia segurar os ganhos recentes"
04/03/2019 às 13h23,"Afastamento na Vale não foi completa surpresa, avalia Morgan Stanley
",Instituição considera ainda que nomeação de Eduardo Bartolomeu como interino é positiva
04/03/2019 às 09h46,"Diretor-presidente interino da Vale está há 10 anos na companhia
",Eduardo Bartolomeo assumiu o comando da mineradora após o afastamento de Fabio Schvartsman no último sábado 
04/03/2019 às 08h23,"SP terá escola internacional francesa de tempo integral por R$ 3.000
","O Grand Lycée Pasteur, que contou com um investimento de R$ 150 milhões, é a fusão do Lycée, de currículo bilíngue, com o Liceu Pasteur"
04/03/2019 às 01h40,"Justiça mantém suspensa a cobrança em pedágio da Econorte no Paraná 
",
03/03/2019 às 19h46,"Mercado já esperava a mudança na diretoria da Vale, diz fonte
",Ações da companhia devem manter uma reação neutra no primeiro pregão após o carnaval
03/03/2019 às 15h45,"Credores da Odebrecht propõem pacote de reestruturação da dívida
","Grupo internacional detém mais de US$ 1 bilhão e ofereceu extensão de quatro anos na maturidade dos bônus, mas sem redução do principal"
03/03/2019 às 13h46,"Carnaval de São Paulo passa o do Rio e vira polo de negócios
","A Prefeitura de São Paulo cadastrou 556 desfiles de blocos neste ano, deixando a festa do Rio para trás com 498 cortejos registrados "
03/03/2019 às 10h38,"Mudança definitiva na Vale deve acontecer em abril, diz jornal
","Em abril, também pode aumentar o número de membros do Conselho de Administração da companhia ligados ao setor da mineração"
03/03/2019 às 08h46,"Ministro defende no exterior controle mais rígido de barragens do país
","O ministro de Minas e Energia, Bento de Albuquerque, participa de um encontro em Toronto com executivos e investidores da área de mineração"
02/03/2019 às 22h30,"Diretor da Vale, Peter Poppinga, confirma pedido de afastamento
","Carta foi enviada neste sábado ao conselho de administração da Vale, que aceitou a solicitação"
02/03/2019 às 22h15,"Bartolomeo, novo presidente da Vale, foi cogitado ao posto em 2017
","Executivo chegou a ser considerado para substituir Murilo Ferreira na época, mas escolha recaiu sobre Schvartsman"
02/03/2019 às 21h58,"Vale confirma afastamento temporário de Schvartsman e três diretores
","Eduardo Bartolomeo, diretor de metais básicos, foi confirmado como presidente interino"
02/03/2019 às 21h00,"Presidente da Vale, Fabio Schvartsman, afasta-se do comando da empresa
","Decisão segue recomendação da força-tarefa de Brumadinho. Eduardo Bartolomeo, diretor de metais, vai assumir como presidente interino"
02/03/2019 às 20h00,"Afastamento de Schvartsman da Vale deve ser temporário, dizem fontes
",Outros quatro diretores se anteciparam ao conselho e pediram afastamento das funções até conclusão das investigações em Brumadinho 
02/03/2019 às 19h05,"Fonte do governo confirma saída de Fabio Schvartsman da Vale
",Valor apurou que Schvartsman está escrevendo uma carta confirmando o afastamento do cargo
02/03/2019 às 18h19,"Conselho da Vale decide demitir Fabio Schvartsman, diz revista
",Saída do presidente da companhia havia sido pedida pelo Ministério Público ontem
02/03/2019 às 16h34,"Brumadinho contrata profissionais para atender vítimas da tragédia
","Pessoal será remunerado com recursos da Vale, num total de R$ 2,6 milhões, repassados à prefeitura local"
02/03/2019 às 14h24,"Aeroportos do país devem receber 6,8 mi de passageiros no carnaval
","São esperados 41,7 mil pousos e decolagens entre voos domésticos e internacionais"
01/03/2019 às 22h08,"Delegado que levou Lula a depor em 2016 o avisou sobre morte do neto
","Atual superintendente da Polícia Federal (PF) em Curitiba, onde Lula cumpre pena, delegado Luciano Flores chegou a consolar ex-presidente"
01/03/2019 às 21h28,"Ministério Público e PF recomendam afastamento de diretoria da Vale
","Autoridades que trabalham na investigação da tragédia em MG recomendaram ""imediato afastamento"" de Fabio Scharvtsman e mais 4 diretores"
01/03/2019 às 20h25,"Petrobras eleva diesel em 1,12% nas refinarias
","Com o reajuste, o preço médio do litro do diesel passará de R$ 2,1224 para R$ 2,1462 a partir de sábado (2)"
01/03/2019 às 17h14,"Petrobras fecha venda de fatia no campo de Maromba para BW Offshore
","Companhia norueguesa entrou esta semana, no Cade, para obter a autorização para a aquisição do ativo"
